snapshot_id,expected_file_name,source_domain,export_format,required,purpose,minimum_columns_hint,operator_action
CONFIG,MVP_QAIC_CONFIG.csv,MVP_QAIC_PY,CSV_UTF8,True,Runtime/project configuration snapshot for local cockpit binding.,"key,value OR config_key,config_value",Export the CONFIG tab/range as CSV and save it with this exact name.
PROMPT_SOURCE_REGISTRY,MVP_QAIC_PROMPT_SOURCE_REGISTRY.csv,MVP_QAIC_PY,CSV_UTF8,True,Prompt/source registry used to bind prompt cockpit references.,"source_id,status,source_type,version OR equivalent",Export the prompt/source registry tab or approved source table.
DECISION_JOURNAL,MVP_QAIC_DECISION_JOURNAL.csv,MVP_QAIC_PY,CSV_UTF8,True,Decision journal snapshot for review history and operator traceability.,"journal_id,decision_status,human_final_decision,validation_status",Export the decision journal tab/range as CSV.
PROMPT_REVIEW_WORKBENCH,MVP_QAIC_PROMPT_REVIEW_WORKBENCH.csv,MVP_QAIC_PY,CSV_UTF8,True,Human review rows for prompt patch/apply decisions.,"review_id,item_id,review_status,apply_now,human_note",Export the current prompt review/workbench table as CSV.
LEXIQUE_OR_COCKPIT_DATA,MVP_QAIC_LEXIQUE_OR_COCKPIT_DATA.csv,MVP_QAIC_PY,CSV_UTF8,True,Useful lexique/cockpit data for local UI binding after cache build.,"term,category,definition OR cockpit_key,cockpit_value",Export the approved lexique or current useful cockpit dataset.
